{
  "catalog_version": "1.0.0",
  "audit_level": "Advanced",
  "change_permission": "fix_scoped",
  "profile": {
    "name": "Synthetic single-editor record tool; replace with verified app facts",
    "features": {
      "ui": true,
      "pointer_ui": true,
      "operations": true,
      "inputs": true,
      "persistent_data": true,
      "shared_writes": false,
      "user_changes": true,
      "protected_resources": null,
      "untrusted_execution": null,
      "authentication": null,
      "csrf_surface": null,
      "cors_surface": null,
      "uploads": null,
      "public_endpoints": null,
      "abuse_surface": null,
      "network": true,
      "resource_lifecycle": true,
      "load_requirements": false,
      "realtime": false,
      "offline_sync": false,
      "background_sync": false,
      "deployed": true,
      "important_data": true,
      "operated_service": true
    },
    "rationale": {
      "ui": "Present in the hypothetical browser-based record editor.",
      "pointer_ui": "Present in the hypothetical browser-based record editor.",
      "operations": "Present in the hypothetical browser-based record editor.",
      "inputs": "Present in the hypothetical browser-based record editor.",
      "persistent_data": "Present in the hypothetical browser-based record editor.",
      "shared_writes": "Absent from the hypothetical single-editor, non-synchronizing scope; no load contract requested.",
      "user_changes": "Present in the hypothetical browser-based record editor.",
      "protected_resources": "Not established; inspect the architecture before excluding.",
      "untrusted_execution": "Not established; inspect the architecture before excluding.",
      "authentication": "Not established; inspect the architecture before excluding.",
      "csrf_surface": "Not established; inspect the architecture before excluding.",
      "cors_surface": "Not established; inspect the architecture before excluding.",
      "uploads": "Not established; inspect the architecture before excluding.",
      "public_endpoints": "Not established; inspect the architecture before excluding.",
      "abuse_surface": "Not established; inspect the architecture before excluding.",
      "network": "Present in the hypothetical browser-based record editor.",
      "resource_lifecycle": "Present in the hypothetical browser-based record editor.",
      "load_requirements": "Absent from the hypothetical single-editor, non-synchronizing scope; no load contract requested.",
      "realtime": "Absent from the hypothetical single-editor, non-synchronizing scope; no load contract requested.",
      "offline_sync": "Absent from the hypothetical single-editor, non-synchronizing scope; no load contract requested.",
      "background_sync": "Absent from the hypothetical single-editor, non-synchronizing scope; no load contract requested.",
      "deployed": "Present in the hypothetical browser-based record editor.",
      "important_data": "Present in the hypothetical browser-based record editor.",
      "operated_service": "Present in the hypothetical browser-based record editor."
    }
  },
  "scope_and_limitations": "Synthetic demonstration only. No real application was audited. All observations below are fictional and cannot be used as assurance.",
  "evidence": [
    {
      "id": "demo-trace",
      "location": "examples/evidence.md",
      "description": "Fictional test records for demonstrating decision boundaries; not runtime observations.",
      "environment": "Synthetic fixture; no deployed system",
      "captured_at": "2026-10-28T00:00:00Z",
      "kind": "artifact",
      "synthetic": true
    }
  ],
  "findings": [
    {
      "id": "finding-F01",
      "criterion_id": "F01",
      "status": "fail",
      "severity": "blocker",
      "decision": "fix",
      "reason": "Fictional create action shows success but makes no required write.",
      "requirement_or_goal": "Create must store the submitted record.",
      "affected_users_and_conditions": "All test users creating a record.",
      "evidence_ids": [
        "demo-trace"
      ],
      "decision_inputs": {
        "evidence_sufficient": true,
        "violates_requirement": true,
        "measurable_benefit": true,
        "authorized": true,
        "proportional": true
      },
      "change_scope_cost_risk": "Scoped correction to existing save handler; low cost; verify duplicate and error behavior.",
      "verification_plan": "Create marker DEMO-1; independently read the committed record and compare fields.",
      "observed_outside_level": false
    },
    {
      "id": "finding-F02",
      "criterion_id": "F02",
      "status": "pass",
      "severity": null,
      "decision": "preserve",
      "reason": "Fictional local persistence survives the required refresh/reopen; cloud sync is only a preference.",
      "requirement_or_goal": "Local-only data must survive refresh/reopen; device sync is excluded.",
      "affected_users_and_conditions": "Single-device users reopening the local editor.",
      "evidence_ids": [
        "demo-trace"
      ],
      "decision_inputs": {
        "evidence_sufficient": true,
        "violates_requirement": false,
        "measurable_benefit": false,
        "authorized": false,
        "proportional": true
      },
      "change_scope_cost_risk": "Retain the existing local storage design; no demonstrated benefit from a database migration.",
      "verification_plan": "Recheck marker DEMO-2 after refresh and a complete app reopen.",
      "observed_outside_level": false
    },
    {
      "id": "finding-F03",
      "criterion_id": "F03",
      "status": "unknown",
      "severity": null,
      "decision": "investigate",
      "reason": "Core criterion or at least one relevant feature is present. No test observations recorded yet.",
      "requirement_or_goal": "Collect or link the agreed criterion-specific requirement.",
      "affected_users_and_conditions": "Identify the audience and tested conditions.",
      "evidence_ids": [],
      "decision_inputs": {
        "evidence_sufficient": false,
        "violates_requirement": false,
        "authorized": false,
        "measurable_benefit": false,
        "proportional": true
      },
      "change_scope_cost_risk": "No change authorized or evaluated for this row yet.",
      "verification_plan": "Follow criterion test_steps and verification; link observations before concluding.",
      "observed_outside_level": false
    },
    {
      "id": "finding-F04",
      "criterion_id": "F04",
      "status": "unknown",
      "severity": null,
      "decision": "investigate",
      "reason": "Core criterion or at least one relevant feature is present. No test observations recorded yet.",
      "requirement_or_goal": "Collect or link the agreed criterion-specific requirement.",
      "affected_users_and_conditions": "Identify the audience and tested conditions.",
      "evidence_ids": [],
      "decision_inputs": {
        "evidence_sufficient": false,
        "violates_requirement": false,
        "authorized": false,
        "measurable_benefit": false,
        "proportional": true
      },
      "change_scope_cost_risk": "No change authorized or evaluated for this row yet.",
      "verification_plan": "Follow criterion test_steps and verification; link observations before concluding.",
      "observed_outside_level": false
    },
    {
      "id": "finding-F05",
      "criterion_id": "F05",
      "status": "unknown",
      "severity": null,
      "decision": "investigate",
      "reason": "Core criterion or at least one relevant feature is present. No test observations recorded yet.",
      "requirement_or_goal": "Collect or link the agreed criterion-specific requirement.",
      "affected_users_and_conditions": "Identify the audience and tested conditions.",
      "evidence_ids": [],
      "decision_inputs": {
        "evidence_sufficient": false,
        "violates_requirement": false,
        "authorized": false,
        "measurable_benefit": false,
        "proportional": true
      },
      "change_scope_cost_risk": "No change authorized or evaluated for this row yet.",
      "verification_plan": "Follow criterion test_steps and verification; link observations before concluding.",
      "observed_outside_level": false
    },
    {
      "id": "finding-F06",
      "criterion_id": "F06",
      "status": "not_applicable",
      "severity": null,
      "decision": "preserve",
      "reason": "All relevant features are absent: shared_writes: Absent from the hypothetical single-editor, non-synchronizing scope; no load contract requested.",
      "requirement_or_goal": "Collect or link the agreed criterion-specific requirement.",
      "affected_users_and_conditions": "Identify the audience and tested conditions.",
      "evidence_ids": [],
      "decision_inputs": {
        "evidence_sufficient": true,
        "violates_requirement": false,
        "authorized": false,
        "measurable_benefit": false,
        "proportional": true
      },
      "change_scope_cost_risk": "No change authorized or evaluated for this row yet.",
      "verification_plan": "Follow criterion test_steps and verification; link observations before concluding.",
      "observed_outside_level": false
    },
    {
      "id": "finding-U01",
      "criterion_id": "U01",
      "status": "unknown",
      "severity": null,
      "decision": "investigate",
      "reason": "Core criterion or at least one relevant feature is present. No test observations recorded yet.",
      "requirement_or_goal": "Collect or link the agreed criterion-specific requirement.",
      "affected_users_and_conditions": "Identify the audience and tested conditions.",
      "evidence_ids": [],
      "decision_inputs": {
        "evidence_sufficient": false,
        "violates_requirement": false,
        "authorized": false,
        "measurable_benefit": false,
        "proportional": true
      },